370;MULTIPLE_CHOICE;fr_FR;Qui est apparu en premier, l'œuf ou la poule?;5;;;;Le poulet sans aucun doute;L'œuf, c'est sûr!;On s'en fout ?;Je ne sais pas;;;;;;;;
371;MULTIPLE_CHOICE;en_US;What are you most afraid of?;9;;;;Death;Losing someone;Loneliness;Crowd;"Some ""dangerous"" animals";Height or confined spaces;Being physically impaired due to disability or old age;Being poor or unemployed;Suffering physically;;;
371;MULTIPLE_CHOICE;es_ES;¿Qué es lo que más te da miedo?;9;;;;La Muerte;Perder a alguien;Soledad;Multitud;"Algunos animales ""peligrosos""";La altura o los espacios cerrados;Estar físicamente disminuido debido a la discapacidad o la vejez;Ser pobre o desempleado;Sufrir físicamente;;;
371;MULTIPLE_CHOICE;fr_FR;De quoi avez-vous le plus peur?;9;;;;La Mort;Perdre quelqu'un;Solitude;Foule;"Certains animaux ""dangereux""";La hauteur ou les espaces fermés;Etre physiquement diminué à cause du handicap ou de la vieillesse;Être pauvre ou sans emploi;Souffrir physiquement;;;
372;MULTIPLE_CHOICE;en_US;Do you think women with smaller breasts are less feminine?;7;;;;Yes;The bust size doesn't make femininity;On the contrary! ;;;;;;;;;
372;MULTIPLE_CHOICE;es_ES;¿Crees que las mujeres con menos pecho son menos femeninas?;7;;;;Sí;El tamaño del busto no hace la feminidad;¡Al contrario! ;;;;;;;;;
372;MULTIPLE_CHOICE;fr_FR;Pensez-vous que les femmes qui ont moins de poitrine sont moins féminines ?;7;;;;Oui;Le tour de poitrine ne fait pas la féminité;Au contraire! ;;;;;;;;;
373;MULTIPLE_CHOICE;en_US;Have you ever spied on your partner?;4;;;;No;I searched his pockets;I searched his phone;I checked his emails;I followed him;I hired a detective;;;;;;
373;MULTIPLE_CHOICE;es_ES;¿Alguna vez has espiado a tu pareja?;4;;;;No;Revisé sus bolsillos;Revisé su teléfono;Revisé sus correos electrónicos;Lo seguí;Contraté a un detective;;;;;;
373;MULTIPLE_CHOICE;fr_FR;Avez-vous déjà espionné votre partenaire ?;4;;;;Non;J'ai fouillé ses poches;J'ai fouillé son portable;J'ai vérifié ses emails;Je l'ai suivi;J'ai embauché un détective;;;;;;
374;MULTIPLE_CHOICE;en_US;Would you be willing to change careers to be happier?;9;;;;Yes, I think about it;No, my job allows me to flourish;Yes, but I don't know for which job;Yes, but I haven't found a solution to finance training;;;;;;;;
374;MULTIPLE_CHOICE;es_ES;¿Estarías dispuesto a cambiar de profesión para ser más feliz?;9;;;;Sí, lo pienso;No, mi trabajo me permite florecer;Sí, pero no sé para qué trabajo;Sí, pero no he encontrado una solución para financiar una formación;;;;;;;;
374;MULTIPLE_CHOICE;fr_FR;Seriez-vous prêt à vous reconvertir professionnellement pour être plus heureux?;9;;;;Oui, j'y réfléchis;Non, mon métier me permet de m'épanouir;Oui, mais je ne sais pas pour quel métier;Oui, mais je n'ai pas trouvé de solution pour financer une formation;;;;;;;;
375;MULTIPLE_CHOICE;en_US;Do you believe in aliens?;3;;;;Yes;Yes and they are smarter than humans;Yes, but they might not be as smart as we think;Yes, but I doubt they have already come to earth;No;;;;;;;
375;MULTIPLE_CHOICE;es_ES;¿Crees en los extraterrestres?;3;;;;Sí;Sí y son más inteligentes que los humanos;Sí, pero podrían no ser tan inteligentes como pensamos;Sí, pero dudo que ya hayan venido a la tierra;No;;;;;;;
375;MULTIPLE_CHOICE;fr_FR;Croyez-vous aux aliens ?;3;;;;Oui;Oui et ils sont plus intelligents que les humains;Oui, mais ils pourraient ne pas être aussi intelligents que nous le pensons;Oui, mais je doute qu'ils soient déjà venus sur terre;Non;;;;;;;
376;MULTIPLE_CHOICE;en_US;Would you like to try a threesome?;4;;;;Yes;No;Already done;It depends on the gender of the third person;;;;;;;;
376;MULTIPLE_CHOICE;es_ES;¿Te gustaría probar el sexo a tres?;4;;;;Sí;No;Ya hecho;Depende del sexo de la tercera persona;;;;;;;;
376;MULTIPLE_CHOICE;fr_FR;Est-ce que vous aimeriez essayer le sexe a 3 ?;4;;;;Oui;Non;Déjà Fait;Ca dépend du sexe du 3ème;;;;;;;;
377;MULTIPLE_CHOICE;en_US;What is your favorite type of pet?;8;;;;Dogs;Cats;Birds;Rodents;Reptiles;Insects;Fish;Other mammals;;;;
377;MULTIPLE_CHOICE;es_ES;¿Cuál es tu tipo de mascota favorita?;8;;;;Perros;Gatos;Aves;Roedores;Reptiles;Insectos;Peces;Otros mamíferos;;;;
377;MULTIPLE_CHOICE;fr_FR;Quel est votre type d'animal de compagnie préféré ?;8;;;;Chiens;Chats;Des oiseaux;Rongeurs;Reptiles;Insectes;Des poissons;D'autres mammifères;;;;
379;MULTIPLE_CHOICE;en_US;Have you ever done a striptease for your partner? ;4;;;;What's the point?;I don't dare;I don't know how to dance;Occasionally;All the time;;;;;;;
379;MULTIPLE_CHOICE;es_ES;¿Alguna vez le has hecho un striptease a tu pareja? ;4;;;;¿Cuál es el punto?;No me atrevo;No sé bailar;Ocasionalmente;Todo el tiempo;;;;;;;
379;MULTIPLE_CHOICE;fr_FR;Avez-vous déjà fait un strip-tease à votre partenaire? ;4;;;;Quel intérêt? ;Je n'ose pas;Je ne sais pas danser;Occasionnellement;Tout le temps;;;;;;;
380;MULTIPLE_CHOICE;en_US;What is your favorite chocolate?;5,8;;;;Dark;White;Milk;With nuts / fruits / rice;;;;;;;;
380;MULTIPLE_CHOICE;es_ES;¿Cuál es tu chocolate favorito?;5,8;;;;Negro;Blanco;Con leche;Con nueces / frutas / arroz;;;;;;;;
380;MULTIPLE_CHOICE;fr_FR;Quel est votre chocolat préféré?;5,8;;;;Noir;Blanc;Au lait;Avec noix / fruits / riz;;;;;;;;
381;MULTIPLE_CHOICE;en_US;Do you believe that Jesus died for your sins?;1;;;;I don't believe in Jesus;I think Jesus existed and died but his story was rewritten;He may have died for other things than our sins;Yes, just as the Bible says;I don't know;;;;;;;
381;MULTIPLE_CHOICE;es_ES;¿Crees que Jesús murió por tus pecados?;1;;;;No creo en Jesús;Creo que Jesús existió y murió pero su historia fue reescrita;Puede que haya muerto por otras cosas que nuestros pecados;Sí, tal como dice la Biblia;No sé;;;;;;;
381;MULTIPLE_CHOICE;fr_FR;Croyez-vous que Jésus est mort pour vos péchés?;1;;;;Je ne crois pas en Jésus;Je pense que Jésus a existé et qu'il est mort mais son histoire a été réécrite;Il a pu mourir pour autres choses que nos péchés;Oui, tout comme la Bible dit;Je ne sais pas;;;;;;;
382;MULTIPLE_CHOICE;en_US;What is the meaning of life?;9;;;;Discover the purpose of one's existence;Make people happy around you;Change the world;Pass the torch to future generations;Enjoy the present moment;Get big cars and lots of money;Do good to be accepted in heaven or equivalent;Serve your god or goddess;Others;;;
382;MULTIPLE_CHOICE;es_ES;¿Cuál es el sentido de la vida?;9;;;;Descubrir el propósito de la existencia;Hacer felices a las personas a tu alrededor;Cambiar el mundo;Pasar la antorcha a las generaciones futuras;Disfrutar el momento presente;Obtener grandes autos y mucho dinero;Hacer el bien para ser aceptado en el cielo o equivalente;Servir a tu dios o diosa;Otros;;;
382;MULTIPLE_CHOICE;fr_FR;Quel est le sens de la vie?;9;;;;Découvrir le but de son existence;Rendre les gens heureux autour de vous;Changer le monde;Passer le flambeau aux générations suivantes;Profiter de l'instant présent;Obtenir de grosses voitures et beaucoup d'argent;Faire le bien pour être accepter au paradis ou équivalent;Servir son dieu ou sa déesse;Autres;;;
383;STEP_LABELED;en_US;Would you sometimes like to be in the body of the opposite sex?;4;;;;Never;Once for the experience;Occasionally;Often;All the time;;;;;;;
383;STEP_LABELED;es_ES;¿Le gustaría a veces estar en el cuerpo del sexo opuesto?;4;;;;Nunca;Una vez por la experiencia;Ocasionalmente;A menudo;Todo el tiempo;;;;;;;
383;STEP_LABELED;fr_FR;Aimeriez-vous parfois être dans le corps de l'autre sexe ?;4;;;;Jamais;Une fois pour l'expérience;Occasionnellement;Souvent;Tout le temps;;;;;;;
384;MULTIPLE_CHOICE;en_US;If you could live in another era, which one would you choose?;5,9,11;;;;Prehistory;Antiquity;Middle Ages;Renaissance;European expansion;Scientific revolution;Industrial revolution;20th century;21st century;In the future;;
384;MULTIPLE_CHOICE;es_ES;Si pudieras vivir en otra época, ¿cuál elegirías?;5,9,11;;;;Prehistoria;Antigüedad;Edad Media;Renacimiento;Expansión europea;Revolución científica;Revolución industrial;Siglo XX;Siglo XXI;En el futuro;;
384;MULTIPLE_CHOICE;fr_FR;Si vous pouviez vivre dans une autre époque, laquelle choisiriez-vous?;5,9,11;;;;Préhistoire;Antiquité;Moyen Age;Renaissance;Expansion européenne;Révolution scientifique;Révolution industrielle;20ième siècle;21e siècle;Dans le futur;;
385;MULTIPLE_CHOICE;en_US;Do you exist?;1,9;;;;Yes;No;Actually, I'm not sure;I think I exist in my own world, but the world I perceive might be unreal;I don't care;;;;;;;
385;MULTIPLE_CHOICE;es_ES;¿Existes?;1,9;;;;Sí;No;En realidad, no estoy seguro;Creo que existo en mi propio mundo, pero el mundo que percibo podría ser irreal;No me importa;;;;;;;
385;MULTIPLE_CHOICE;fr_FR;Est-ce que vous existez ?;1,9;;;;Oui;Non;En fait , je ne suis pas sûr;Je pense que j'existe dans mon propre monde, mais le monde que je perçois pourrait être irréel;Peu m'importe;;;;;;;
386;MULTIPLE_CHOICE;en_US;If you could live in another country in the world, which region would you choose?;11;;;;Europe;North America;South America;Asia;Africa;Australia & surroundings;Middle East;Arctic & Antarctic;;;;
386;MULTIPLE_CHOICE;es_ES;Si pudieras vivir en otro país del mundo, ¿qué región elegirías?;11;;;;Europa;América del Norte;América del Sur;Asia;África;Australia y alrededores;Oriente Medio;Ártico y Antártico;;;;
386;MULTIPLE_CHOICE;fr_FR;Si vous pouviez vivre dans un autre pays du monde, quelle région choisiriez-vous?;11;;;;Europe;Amérique du Nord;Amérique du sud;Asie;Afrique;Australie & environs;Moyen Orient;Arctique & Antarctique;;;;
387;MULTIPLE_CHOICE;en_US;What is deception?;4;;;;Desire someone else;Kiss someone else;Look at someone else;Sleep with someone else;;;;;;;;
387;MULTIPLE_CHOICE;es_ES;¿Qué es el engaño?;4;;;;Desear a otra persona;Besar a otra persona;Mirar a otra persona;Acostarse con otra persona;;;;;;;;
387;MULTIPLE_CHOICE;fr_FR;Qu'est ce que la tromperie?;4;;;;Désirer quelqu'un d'autre;Embrasser quelqu'un d'autre;Regarder quelqu'un d'autre;Coucher avec quelqu'un d'autre;;;;;;;;
388;MULTIPLE_CHOICE;en_US;Who is the greatest tennis player of all time?;12;;;;Federer;Nadal;Borg;Laver;McEnroe;Djokovic;Sampras;Agassi;Lendl;Connors;;
388;MULTIPLE_CHOICE;es_ES;¿Quién es el mejor tenista de todos los tiempos?;12;;;;Federer;Nadal;Borg;Laver;McEnroe;Djokovic;Sampras;Agassi;Lendl;Connors;;
388;MULTIPLE_CHOICE;fr_FR;Quel est le meilleur joueur de tennis de tous les temps ?;12;;;;Federer;Nadal;Borg;Laver;McEnroe;Djokovic;Sampras;Agassi;Lendl;Connors;;
389;MULTIPLE_CHOICE;en_US;What do you think of Donald Trump?;2,11;;;;He is an impostor;He is charismatic;He is a liar;He is brilliant;He only lives for money;He built himself;He is a demagogue;He is the change America needs;;;;
389;MULTIPLE_CHOICE;es_ES;¿Qué opinas de Donald Trump?;2,11;;;;Es un impostor;Es carismático;Es un mentiroso;Es brillante;Solo vive por el dinero;Se construyó a sí mismo;Es un demagogo;Es el cambio que América necesita;;;;
389;MULTIPLE_CHOICE;fr_FR;Que pensez-vous de Donald Trump?;2,11;;;;Il est un usurpateur;Il est charismatique;Il est un menteur;Il est brillant;Il ne vit que pour l'argent;Il s'est construit lui-même;Il est démagogue;Il est le changement dont l'Amérique a besoin;;;;
390;MULTIPLE_CHOICE;en_US;Which newly selected sport for the 2024 Olympics has a lasting place?;12;;;;Breakdance;Surf;Skateboard;Climbing;;;;;;;;
390;MULTIPLE_CHOICE;es_ES;¿Qué deporte recién elegido para los Juegos Olímpicos de 2024 tiene un lugar duradero?;12;;;;Breakdance;Surf;Skateboard;Escalada;;;;;;;;
390;MULTIPLE_CHOICE;fr_FR;Quel sport nouvellement choisi pour les Jeux olympiques de 2024 a sa place durablement ?;12;;;;Breakdance;Surf;Skateboard;Escalade;;;;;;;;
391;MULTIPLE_CHOICE;en_US;Are you ready to change?;9;;;;Yes and I do it;I would like to but it's difficult;Why should I?;No, I don't want to;;;;;;;;
391;MULTIPLE_CHOICE;es_ES;¿Estás listo para cambiar?;9;;;;Sí y lo hago;Me gustaría pero es difícil;¿Por qué debería?;No, no quiero;;;;;;;;
391;MULTIPLE_CHOICE;fr_FR;Êtes-vous prêt à changer?;9;;;;Oui et je le fais;Je voudrais mais c'est difficile;Pourquoi devrai-je ?;Non, je ne veux pas;;;;;;;;
392;MULTIPLE_CHOICE;en_US;Are you concerned about global warming?;3,11;;;;It's nonsense;Not at all;A little sometimes;Yes, but I'm not going to change my habits;This is something we cannot ignore;It's very important;Yes all the time;;;;;
392;MULTIPLE_CHOICE;es_ES;¿Te preocupa el calentamiento global?;3,11;;;;Es una tontería;Para nada;Un poco a veces;Sí, pero no voy a cambiar mis hábitos;Esto es algo que no podemos ignorar;Es muy importante;Sí todo el tiempo;;;;;
392;MULTIPLE_CHOICE;fr_FR;Etes-vous inquiet à propos du réchauffement climatique?;3,11;;;;C'est des conneries;Pas du tout;Un peu parfois;oui, mais je ne vais pas changer mes habitudes;Ceci est quelque chose que nous ne pouvons pas ignorer;C'est très important;Oui tout le temps;;;;;
393;MULTIPLE_CHOICE;en_US;How can we eliminate pain and hatred from the world?;11;;;;It's not possible;By trying to improve every day;By launching movements on the Internet;By getting involved in politics;By removing politics from our system;Through better education in the world;By distributing wealth fairly in the world;By praying to God;By making humans disappear;Others;;
393;MULTIPLE_CHOICE;es_ES;¿Cómo podemos eliminar el dolor y el odio del mundo?;11;;;;No es posible;Tratando de mejorar cada día;Lanzando movimientos en Internet;Involucrándose en política;Eliminando la política de nuestro sistema;A través de una mejor educación en el mundo;Distribuyendo la riqueza de manera justa en el mundo;Rezando a Dios;Haciendo desaparecer a los humanos;Otros;;
393;MULTIPLE_CHOICE;fr_FR;Comment pouvons-nous supprimer la douleur et la haine du monde?;11;;;;Ce n'est pas possible;En tâchant de s'améliorer tous les jours;En lançant des mouvements sur Internet;En s'investissant en politique;En supprimant la politique de notre système;Grâce à une meilleure éducation dans le monde;En répartissant la richesse équitablement dans le monde;En priant Dieu;En faisant disparaître les humains;Autres;;
394;MULTIPLE_CHOICE;en_US;Which world power is doing best at the moment?;2;;;;Europe;Japan;Russia;Canada;USA;South America;Middle East;Africa;China;India;;
394;MULTIPLE_CHOICE;es_ES;¿Qué potencia mundial está mejor parada en este momento?;2;;;;Europa;Japón;Rusia;Canadá;EE.UU.;América del Sur;Oriente Medio;África;China;India;;
394;MULTIPLE_CHOICE;fr_FR;Quelle puissance mondiale s'en sort le mieux en ce moment ?;2;;;;Europe;Japon;Russie;Canada;USA;Amérique du Sud;Moyen Orient;Afrique;Chine;Indes;;
395;MULTIPLE_CHOICE;en_US;Which way do you prefer to use toilet paper, with the sheets dispensed from the front or the back?;5,8;;;;Sheets distributed from the front;Sheets distributed from the back;No opinion;;;;;;;;;
395;MULTIPLE_CHOICE;es_ES;¿Cómo prefieres usar el rollo de papel higiénico, con las hojas distribuyéndose por delante o por detrás?;5,8;;;;Hojas distribuidas desde el frente;Hojas distribuidas desde atrás;Sin opinión;;;;;;;;;
395;MULTIPLE_CHOICE;fr_FR;Dans quel sens préfèrez-vous utiliser le rouleau de papier toilette, les feuilles distribuées par l'avant ou par l'arrière?;5,8;;;;Les feuilles distribuées par l'avant;Les feuilles distribuées par l'arrière;Pas d'avis;;;;;;;;;
397;OPEN;en_US;What achievement are you most proud of?;9;;;;;;;;;;;;;;;
397;OPEN;es_ES;¿Cuál es el logro del que te sientes más orgulloso?;9;;;;;;;;;;;;;;;
397;OPEN;fr_FR;Quel est l'accomplissement dont vous êtes le plus fier?;9;;;;;;;;;;;;;;;
398;MULTIPLE_CHOICE;en_US;Do you think the switch to the euro has increased the cost of living?;2,8;;;;Yes;No;No idea;I wasn't born;;;;;;;;
398;MULTIPLE_CHOICE;es_ES;¿Crees que el paso al euro ha aumentado el coste de la vida?;2,8;;;;Sí;No;No tengo idea;No había nacido;;;;;;;;
398;MULTIPLE_CHOICE;fr_FR;Pensez-vous que le passage à l'Euro a augmenté le coût de la vie ?;2,8;;;;Oui;Non;Aucune idée;Je n'étais pas né;;;;;;;;
399;OPEN;en_US;If you could have a superpower, what would it be?;5;;;;;;;;;;;;;;;
399;OPEN;es_ES;Si pudieras tener un superpoder, ¿cuál sería?;5;;;;;;;;;;;;;;;
399;OPEN;fr_FR;Si vous pouviez obtenir un super-pouvoir, quel serait-il?;5;;;;;;;;;;;;;;;
400;MULTIPLE_CHOICE;en_US;Do you think Trump is really crazy or, on the contrary, very intelligent?;2;;;;Crazy;Smart;Clever;;;;;;;;;
400;MULTIPLE_CHOICE;es_ES;¿Crees que Trump está realmente loco o, por el contrario, es muy inteligente?;2;;;;Loco;Inteligente;Astuto;;;;;;;;;
400;MULTIPLE_CHOICE;fr_FR;Croyez-vous Trump réellement fou ou au contraire très intelligent ?;2;;;;Fou;Intelligent;Malin;;;;;;;;;
401;MULTIPLE_CHOICE;en_US;Do you think your life contributes positively or negatively to society?;9;;;;Good;Bad;I don't know;;;;;;;;;
401;MULTIPLE_CHOICE;es_ES;¿Crees que tu vida aporta algo positivo o negativo a la sociedad?;9;;;;Bueno;Malo;No sé;;;;;;;;;
401;MULTIPLE_CHOICE;fr_FR;Pensez-vous que votre vie apporte du positif ou du négatif à la société?;9;;;;Bien;Mal;Je ne sais pas;;;;;;;;;
402;MULTIPLE_CHOICE;en_US;Which world power is doing best at the moment?;2;;;;Europe;Japan;Russia;Canada;USA;South America;Middle East;Africa;China;India;;
402;MULTIPLE_CHOICE;es_ES;¿Qué potencia mundial está mejor parada en este momento?;2;;;;Europa;Japón;Rusia;Canadá;EE.UU.;América del Sur;Oriente Medio;África;China;India;;
402;MULTIPLE_CHOICE;fr_FR;Quelle puissance mondiale s'en sort le mieux en ce moment ?;2;;;;Europe;Japon;Russie;Canada;USA;Amérique du Sud;Moyen Orient;Afrique;Chine;Indes;;
403;MULTIPLE_CHOICE;en_US;Do you approve of medical experiments on animals?;3,11;;;;Yes;No;Only for the progress of medicine;It depends on the animals used;;;;;;;;
403;MULTIPLE_CHOICE;es_ES;¿Estás de acuerdo con los experimentos médicos con animales?;3,11;;;;Sí;No;Solo para el progreso de la medicina;Depende de los animales utilizados;;;;;;;;
403;MULTIPLE_CHOICE;fr_FR;Approuvez-vous les expériences médicales sur les animaux ?;3,11;;;;Oui;Non;Seulement pour le progrès de la mèdecine;Ca dépend des animaux utilisés;;;;;;;;
404;MULTIPLE_CHOICE;en_US;Could you have sex with someone who has AIDS?;4,7;;;;Impossible;No but I could;For one night;Several times;;;;;;;;
404;MULTIPLE_CHOICE;es_ES;¿Podrías tener relaciones sexuales con una persona con sida?;4,7;;;;Imposible;No, pero podría;Por una noche;Varias veces;;;;;;;;
404;MULTIPLE_CHOICE;fr_FR;Pourriez-vous avoir une relation sexuelle avec une personne atteinte du sida?;4,7;;;;Impossible;Non mais je pourrais;Pour un soir;Plusieurs fois;;;;;;;;
405;MULTIPLE_CHOICE;en_US;Do you live mainly for yourself or for others?;7,9;;;;Only for me;Mainly for myself;I try to find the right balance;Mainly for others;Only for others;;;;;;;
405;MULTIPLE_CHOICE;es_ES;¿Vives principalmente para ti mismo o para los demás?;7,9;;;;Solo para mí;Principalmente para mí;Intento encontrar el equilibrio adecuado;Principalmente para otros;Solo para otros;;;;;;;
405;MULTIPLE_CHOICE;fr_FR;Vivez-vous principalement pour vous-même ou pour les autres?;7,9;;;;Uniquement pour moi;Principalement pour moi-même;J'essaie de trouver le juste équilibre;Principalement pour les autres;Seulement pour les autres;;;;;;;
406;MULTIPLE_CHOICE;en_US;What makes you cry the most in movies?;6,9;;;;When a character dies;When a character overcomes their weaknesses;When a character makes a family member proud;When a character helps strangers;When life is unfair to one of the characters;They lived happily ever after;When a character gives their life to save another;When evil triumphs;Others;;;
406;MULTIPLE_CHOICE;es_ES;¿Qué es lo que más te hace llorar en las películas?;6,9;;;;Cuando un personaje muere;Cuando un personaje supera sus debilidades;Cuando un personaje hace sentir orgulloso a un miembro de la familia;Cuando un personaje ayuda a extraños;Cuando la vida es injusta con uno de los personajes;Vivieron felices para siempre;Cuando un personaje da su vida para salvar a otro;Cuando el mal triunfa;Otros;;;
406;MULTIPLE_CHOICE;fr_FR;Qu'est-ce qui vous fait pleurer le plus dans les films?;6,9;;;;Quand un personnage meurt;Quand un personnage surmonte ses faiblesses;Quand un personnage rend fier un membre de sa famille;Quand un personnage aide des inconnus;Quand la vie est injuste avec un des personnages;Ils vécurent heureux et eurent beaucoup d'enfants..;Quand un personnage donne sa vie pour sauver celle d'un d'autre;Quand le mal triomphe;Autres;;;
407;MULTIPLE_CHOICE;en_US;Would you rather have one very good friend or lots of friends?;7;;;;A very good friend;Many buddies;;;;;;;;;;
407;MULTIPLE_CHOICE;es_ES;¿Prefieres tener un buen amigo o muchos amigos?;7;;;;Un muy buen amigo;Muchos amigos;;;;;;;;;;
407;MULTIPLE_CHOICE;fr_FR;Préféreriez-vous un très bon ami ou beaucoup de copains?;7;;;;Un très bon ami;Beaucoup de copains;;;;;;;;;;
408;MULTIPLE_CHOICE;en_US;Do you prefer to have sex in the dark or in the light?;4;;;;In the dark;In the light;;;;;;;;;;
408;MULTIPLE_CHOICE;es_ES;¿Prefieres hacer el amor a oscuras o con la luz encendida?;4;;;;En la oscuridad;En la luz;;;;;;;;;;
408;MULTIPLE_CHOICE;fr_FR;Préférez-vous faire l'amour dans le noir ou dans la lumière?;4;;;;Dans le noir;Dans la lumière;;;;;;;;;;
409;MULTIPLE_CHOICE;en_US;Have you ever anonymously reported someone?;7;;;;Never had the chance;I had to do it;Yes for fun;Often;;;;;;;;
409;MULTIPLE_CHOICE;es_ES;¿Alguna vez has denunciado a alguien de forma anónima?;7;;;;Nunca tuve la oportunidad;Tuve que hacerlo;Sí por diversión;A menudo;;;;;;;;
409;MULTIPLE_CHOICE;fr_FR;Avez-vous déjà dénoncé quelqu'un anonymement ?;7;;;;Jamais eu l'occasion;Je devais le faire;Oui pour le plaisir;Souvent;;;;;;;;
410;MULTIPLE_CHOICE;en_US;What position do you sleep in?;4;;;;On the back;On the stomach;On the side;;;;;;;;;
410;MULTIPLE_CHOICE;es_ES;¿En qué posición te duermes?;4;;;;De espaldas;Boca abajo;De lado;;;;;;;;;
410;MULTIPLE_CHOICE;fr_FR;Dans quelle position vous endormez-vous ?;4;;;;Sur le dos;Sur le ventre;Sur le côté;;;;;;;;;
411;MULTIPLE_CHOICE;en_US;Are you sometimes afraid of other people?;7,9;;;;Never;Only some described in the media;I haven't been comfortable with some people several times this year;I think safe people are becoming rarer;Yes, quite often actually;To the point that I don't want to leave my house anymore;;;;;;
411;MULTIPLE_CHOICE;es_ES;¿A veces tienes miedo de los demás?;7,9;;;;Nunca;Solo algunos descritos en los medios;No me he sentido cómodo con algunas personas varias veces este año;Creo que las personas seguras son cada vez más raras;Sí, bastante a menudo en realidad;Hasta el punto de que ya no quiero salir de mi casa;;;;;;
411;MULTIPLE_CHOICE;fr_FR;Avez-vous parfois peur des autres humains?;7,9;;;;Jamais;Seulement certains décrits dans les médias;Je n'ai pas été à l' aise avec certaines personnes plusieurs fois cette année;Je pense que les gens sûrs sont de plus en plus rares;Oui, assez souvent en fait;Au point que je ne veuille plus quitter ma maison;;;;;;
412;MULTIPLE_CHOICE;en_US;Have you ever left without paying?;8;;;;Never;Accidentally;To try;Regularly;;;;;;;;
412;MULTIPLE_CHOICE;es_ES;¿Alguna vez te has ido sin pagar?;8;;;;Nunca;Accidentalmente;Para probar;Regularmente;;;;;;;;
412;MULTIPLE_CHOICE;fr_FR;Etes-vous déjà parti sans payer ?;8;;;;Jamais;Sans faire Exprès;Pour essayer;Régulièrement;;;;;;;;
413;OPEN;en_US;What is your most precious possession?;8,9;;;;;;;;;;;;;;;
413;OPEN;es_ES;¿Cuál es tu bien más preciado?;8,9;;;;;;;;;;;;;;;
413;OPEN;fr_FR;Quelle est votre bien le plus précieux?;8,9;;;;;;;;;;;;;;;
414;MULTIPLE_CHOICE;en_US;In presidential elections, do you prioritize the interests of your country or your own interests?;2;;;;The interest of my country;My personal interest;;;;;;;;;;
414;MULTIPLE_CHOICE;es_ES;En las elecciones presidenciales, ¿antepones los intereses de tu país o los tuyos propios?;2;;;;El interés de mi país;Mi interés personal;;;;;;;;;;
414;MULTIPLE_CHOICE;fr_FR;Aux élections présidentielles, privilégiez-vous l'intérêt de votre pays ou votre intérêt ?;2;;;;L'intérêt de mon pays;Mon intérêt personnel;;;;;;;;;;
415;MULTIPLE_CHOICE;en_US;Are you OK?;5;;;;Yes, great!!;Meh, meh....;;;;;;;;;;
415;MULTIPLE_CHOICE;es_ES;¿Estás bien?;5;;;;¡Sí, genial!;Meh, meh....;;;;;;;;;;
415;MULTIPLE_CHOICE;fr_FR;ça va vous ?;5;;;;Oui, super !!;bof, bof ....;;;;;;;;;;
416;MULTIPLE_CHOICE;en_US;Would you be capable of going to war to defend your country?;2,9;;;;Of course;Only if I'm called;I will try to avoid;I prefer to run away;;;;;;;;
416;MULTIPLE_CHOICE;es_ES;¿Serías capaz de ir a la guerra para defender tu país?;2,9;;;;Por supuesto;Solo si me llaman;Intentaré evitarlo;Prefiero huir;;;;;;;;
416;MULTIPLE_CHOICE;fr_FR;Seriez-vous capable de faire la guerre pour défendre votre pays?;2,9;;;;Bien sûr;Uniquement si je suis appelé;J'essaierai d'éviter;Je préfère encore fuir;;;;;;;;
417;MULTIPLE_CHOICE;en_US;Can a long-distance relationship work?;4;;;;No never;Possible, as long as the two lovers don't meet others;Yes, but it requires a lot of effort;It depends on the strength of love and not the distance;;;;;;;;
417;MULTIPLE_CHOICE;es_ES;¿Puede funcionar una relación a distancia?;4;;;;No nunca;Posible, siempre que los dos amantes no se encuentren con otros;Sí, pero requiere mucho esfuerzo;Depende de la fuerza del amor y no de la distancia;;;;;;;;
